{
  "evidence_id": "legacy-sg-safety-baseline-dec-0071-pr-72",
  "schema_version": "2.0.0",
  "kind": "LEGACY_ACCEPTANCE",
  "repository_id": "1296080967",
  "object_format": "sha1",
  "tested_commit": null,
  "tested_tree": null,
  "base_commit": "136958a1bf2493983b4413f7d231ee5adbd913bf",
  "merge_base": null,
  "capability_ids": ["sg.safety.baseline"],
  "component_ids": [],
  "component_manifest": null,
  "state_schema_hash": null,
  "config_version": "2.0.0",
  "registry_hash": null,
  "gate_id": null,
  "gate_definition_hash": null,
  "profile_hash": null,
  "test_plan_hash": null,
  "test_source_hash": null,
  "fixture_hash": null,
  "environment": null,
  "runner_version": null,
  "observation": "PASS",
  "reason_codes": ["FORMAL_ACCEPTANCE_MIGRATED"],
  "report_sha256": null,
  "provenance": "FORMAL_GIT",
  "executed_at": null,
  "external_validity": null,
  "source": {"decision": "DEC-0071", "pull_request": 72, "formal_commit": "136958a1bf2493983b4413f7d231ee5adbd913bf"}
}
